{"dates":["2026-10-13","2026-10-22","2026-10-29"],"totals":{"offers":[4908,5065,5065],"priced":[4894,5045,5045],"special_min":[115840,115840,115840],"special_median":[269500.0,268064.0,268064.0],"special_max":[938671,938671,938671],"discount_pct_median":[0.2,0.18,0.18],"rates":{"APL-1":{"priced":[762,847,847],"rate_min":[1145,1145,1145],"rate_median":[1348.0,1361.0,1361.0]},"APL-2":{"priced":[57,52,52],"rate_min":[1068,1065,1065],"rate_median":[1323.0,1323.5,1323.5]},"APL-2-EV":{"priced":[94,82,82],"rate_min":[1389,1471,1471],"rate_median":[1683.0,1683.0,1683.0]},"APL-3":{"priced":[3981,4064,4064],"rate_min":[646,646,646],"rate_median":[1743.0,1811.5,1811.5]}},"promo_counts":{"bo":[2221,2086,2086],"fe":[224,198,198],"l101":[4814,4956,4956],"pu":[1875,1797,1797],"be":[3312,3391,3391],"p15":[94,82,82]},"net_added":[null,361,0],"net_removed":[null,204,0],"lfl_index":[100.0,100.0,100.0],"slider_counts":{"bo":[2221,2086,2086],"fe":[224,198,198],"l101":[4813,4956,4956],"pu":[1875,1797,1797],"be":[3312,3391,3391],"pks":[1651,1599,1599]},"config_drops":[null,41,0]},"segments":{"A":{"offers":[2124,2201,2201],"priced":[2124,2201,2201],"special_min":[115840,115840,115840],"special_median":[220696.0,216727.0,216727.0],"special_max":[546260,546260,546260],"discount_pct_median":[0.18,0.18,0.18],"rates":{"APL-1":{"priced":[637,689,689],"rate_min":[1145,1145,1145],"rate_median":[1330.0,1332.0,1332.0]},"APL-3":{"priced":[1487,1512,1512],"rate_min":[646,646,646],"rate_median":[1835.0,1849.0,1849.0]}},"promo_counts":{"bo":[607,584,584],"fe":[0,0,0],"l101":[2051,2116,2116],"pu":[491,497,497],"be":[1367,1398,1398],"p15":[0,0,0]},"net_added":[null,145,0],"net_removed":[null,68,0],"lfl_index":[100.0,100.0,100.0],"slider_counts":{"bo":[607,584,584],"fe":[0,0,0],"l101":[2051,2116,2116],"pu":[491,497,497],"be":[1367,1398,1398],"pks":[491,497,497]}},"Q":{"offers":[2362,2452,2452],"priced":[2360,2450,2450],"special_min":[187392,187392,187392],"special_median":[281745.0,281024.0,281024.0],"special_max":[544226,550205,550205],"discount_pct_median":[0.2,0.2,0.2],"rates":{"APL-1":{"priced":[50,81,81],"rate_min":[3413,3413,3413],"rate_median":[4454.0,4454.0,4454.0]},"APL-3":{"priced":[2310,2369,2369],"rate_min":[967,967,967],"rate_median":[1519.5,1678.0,1678.0]}},"promo_counts":{"bo":[1555,1453,1453],"fe":[224,198,198],"l101":[2360,2450,2450],"pu":[1375,1293,1293],"be":[1945,1993,1993],"p15":[0,0,0]},"net_added":[null,183,0],"net_removed":[null,93,0],"lfl_index":[100.0,100.0,100.0],"slider_counts":{"bo":[1555,1453,1453],"fe":[224,198,198],"l101":[2360,2450,2450],"pu":[1375,1293,1293],"be":[1945,1993,1993],"pks":[1151,1095,1095]}},"S/RS":{"offers":[278,285,285],"priced":[266,267,267],"special_min":[187120,187120,187120],"special_median":[434631.5,434226.0,434226.0],"special_max":[938671,938671,938671],"discount_pct_median":[0.18,0.15,0.15],"rates":{"APL-1":{"priced":[75,77,77],"rate_min":[2108,2108,2108],"rate_median":[3432.0,3422.0,3422.0]},"APL-2":{"priced":[2,0,0],"rate_min":[null,null,null],"rate_median":[null,null,null]},"APL-2-EV":{"priced":[5,7,7],"rate_min":[2242,2147,2147],"rate_median":[2420.0,2420.0,2420.0]},"APL-3":{"priced":[184,183,183],"rate_min":[1043,1043,1043],"rate_median":[4479.5,4526.0,4526.0]}},"promo_counts":{"bo":[59,49,49],"fe":[0,0,0],"l101":[259,263,263],"pu":[9,7,7],"be":[0,0,0],"p15":[5,7,7]},"net_added":[null,27,0],"net_removed":[null,20,0],"lfl_index":[100.0,100.0,100.0],"slider_counts":{"bo":[59,49,49],"fe":[0,0,0],"l101":[258,263,263],"pu":[9,7,7],"be":[0,0,0],"pks":[9,7,7]}},"e-tron":{"offers":[144,127,127],"priced":[144,127,127],"special_min":[206731,206025,206025],"special_median":[276602.5,275622.0,275622.0],"special_max":[558274,558274,558274],"discount_pct_median":[0.24,0.24,0.24],"rates":{"APL-2":{"priced":[55,52,52],"rate_min":[1068,1065,1065],"rate_median":[1323.0,1323.5,1323.5]},"APL-2-EV":{"priced":[89,75,75],"rate_min":[1389,1471,1471],"rate_median":[1666.0,1666.0,1666.0]}},"promo_counts":{"bo":[0,0,0],"fe":[0,0,0],"l101":[144,127,127],"pu":[0,0,0],"be":[0,0,0],"p15":[89,75,75]},"net_added":[null,6,0],"net_removed":[null,23,0],"lfl_index":[100.0,100.0,100.0],"slider_counts":{"bo":[0,0,0],"fe":[0,0,0],"l101":[144,127,127],"pu":[0,0,0],"be":[0,0,0],"pks":[0,0,0]}}},"models":{"a3-limousine":{"offers":[297,308,308],"priced":[297,308,308],"special_min":[115840,115840,115840],"special_median":[160753.0,161270.0,161270.0],"special_max":[199105,199105,199105],"discount_pct_median":[0.18,0.18,0.18],"rates":{"APL-1":{"priced":[292,302,302],"rate_min":[1145,1145,1145],"rate_median":[1330.0,1331.0,1331.0]},"APL-3":{"priced":[5,6,6],"rate_min":[646,646,646],"rate_median":[748.0,788.0,788.0]}},"promo_counts":{"bo":[5,6,6],"fe":[0,0,0],"l101":[297,308,308],"pu":[0,0,0],"be":[205,214,214],"p15":[0,0,0]},"net_added":[null,13,0],"net_removed":[null,2,0],"lfl_index":[100.0,100.0,100.0],"lowest_version_special":[115840,115840,115840],"slider_counts":{"bo":[5,6,6],"fe":[0,0,0],"l101":[297,308,308],"pu":[0,0,0],"be":[205,214,214],"pks":[0,0,0]}},"a3-sportback":{"offers":[378,433,433],"priced":[378,433,433],"special_min":[120296,119602,119602],"special_median":[152898.0,152217.0,152217.0],"special_max":[187001,187001,187001],"discount_pct_median":[0.18,0.18,0.18],"rates":{"APL-1":{"priced":[298,331,331],"rate_min":[1150,1150,1150],"rate_median":[1317.0,1322.0,1322.0]},"APL-3":{"priced":[80,102,102],"rate_min":[680,667,667],"rate_median":[803.0,739.5,739.5]}},"promo_counts":{"bo":[80,102,102],"fe":[0,0,0],"l101":[378,433,433],"pu":[0,0,0],"be":[172,184,184],"p15":[0,0,0]},"net_added":[null,70,0],"net_removed":[null,15,0],"lfl_index":[100.0,100.0,100.0],"lowest_version_special":[120296,119602,119602],"slider_counts":{"bo":[80,102,102],"fe":[0,0,0],"l101":[378,433,433],"pu":[0,0,0],"be":[172,184,184],"pks":[0,0,0]}},"a3-sportback-tfsi-e":{"offers":[15,11,11],"priced":[15,11,11],"special_min":[171221,171221,171221],"special_median":[177362.0,177362.0,177362.0],"special_max":[188116,183480,183480],"discount_pct_median":[0.24,0.24,0.24],"rates":{"APL-3":{"priced":[15,11,11],"rate_min":[955,955,955],"rate_median":[989.0,989.0,989.0]}},"promo_counts":{"bo":[15,11,11],"fe":[0,0,0],"l101":[15,11,11],"pu":[0,0,0],"be":[0,0,0],"p15":[0,0,0]},"net_added":[null,0,0],"net_removed":[null,4,0],"lfl_index":[100.0,100.0,100.0],"lowest_version_special":[171221,171221,171221],"slider_counts":{"bo":[15,11,11],"fe":[0,0,0],"l101":[15,11,11],"pu":[0,0,0],"be":[0,0,0],"pks":[0,0,0]}},"a3-sportback-e-hybrid":{"offers":[15,18,18],"priced":[15,18,18],"special_min":[177895,177895,177895],"special_median":[195484.0,195655.5,195655.5],"special_max":[206170,206170,206170],"discount_pct_median":[0.22,0.22,0.22],"rates":{"APL-1":{"priced":[15,18,18],"rate_min":[1523,1523,1523],"rate_median":[1674.0,1675.5,1675.5]}},"promo_counts":{"bo":[0,0,0],"fe":[0,0,0],"l101":[0,0,0],"pu":[0,0,0],"be":[15,18,18],"p15":[0,0,0]},"net_added":[null,3,0],"net_removed":[null,0,0],"lfl_index":[100.0,100.37,100.37],"lowest_version_special":[177895,177895,177895],"slider_counts":{"bo":[0,0,0],"fe":[0,0,0],"l101":[0,0,0],"pu":[0,0,0],"be":[15,18,18],"pks":[0,0,0]}},"a3-allstreet":{"offers":[76,69,69],"priced":[76,69,69],"special_min":[130933,130933,130933],"special_median":[148865.5,161631.0,161631.0],"special_max":[186788,186788,186788],"discount_pct_median":[0.24,0.18,0.18],"rates":{"APL-1":{"priced":[29,35,35],"rate_min":[1271,1271,1271],"rate_median":[1393.0,1387.0,1387.0]},"APL-3":{"priced":[47,34,34],"rate_min":[730,730,730],"rate_median":[796.0,803.0,803.0]}},"promo_counts":{"bo":[47,34,34],"fe":[0,0,0],"l101":[76,69,69],"pu":[0,0,0],"be":[29,35,35],"p15":[0,0,0]},"net_added":[null,6,0],"net_removed":[null,13,0],"lfl_index":[100.0,100.23,100.23],"lowest_version_special":[130933,130933,130933],"slider_counts":{"bo":[47,34,34],"fe":[0,0,0],"l101":[76,69,69],"pu":[0,0,0],"be":[29,35,35],"pks":[0,0,0]}},"a3-allstreet-e-hybrid":{"offers":[3,3,3],"priced":[3,3,3],"special_min":[197356,197356,197356],"special_median":[198222.0,198222.0,198222.0],"special_max":[198222,198222,198222],"discount_pct_median":[0.22,0.22,0.22],"rates":{"APL-1":{"priced":[3,3,3],"rate_min":[1690,1690,1690],"rate_median":[1697.0,1697.0,1697.0]}},"promo_counts":{"bo":[0,0,0],"fe":[0,0,0],"l101":[0,0,0],"pu":[0,0,0],"be":[3,3,3],"p15":[0,0,0]},"net_added":[null,0,0],"net_removed":[null,0,0],"lfl_index":[100.0,100.0,100.0],"lowest_version_special":[197356,197356,197356],"slider_counts":{"bo":[0,0,0],"fe":[0,0,0],"l101":[0,0,0],"pu":[0,0,0],"be":[3,3,3],"pks":[0,0,0]}},"a5-avant":{"offers":[308,318,318],"priced":[308,318,318],"special_min":[167981,167981,167981],"special_median":[235181.5,233786.0,233786.0],"special_max":[339663,339663,339663],"discount_pct_median":[0.18,0.18,0.18],"rates":{"APL-3":{"priced":[308,318,318],"rate_min":[913,913,913],"rate_median":[1829.0,1812.5,1812.5]}},"promo_counts":{"bo":[102,99,99],"fe":[0,0,0],"l101":[308,318,318],"pu":[0,0,0],"be":[208,210,210],"p15":[0,0,0]},"net_added":[null,11,0],"net_removed":[null,1,0],"lfl_index":[100.0,100.0,100.0],"lowest_version_special":[167981,167981,167981],"slider_counts":{"bo":[102,99,99],"fe":[0,0,0],"l101":[308,318,318],"pu":[0,0,0],"be":[208,210,210],"pks":[0,0,0]}},"a5-avant-e-hybrid":{"offers":[61,63,63],"priced":[61,63,63],"special_min":[248282,248282,248282],"special_median":[280917.0,279942.0,279942.0],"special_max":[336008,336008,336008],"discount_pct_median":[0.22,0.2,0.2],"rates":{"APL-3":{"priced":[61,63,63],"rate_min":[1349,1349,1349],"rate_median":[1637.0,2190.0,2190.0]}},"promo_counts":{"bo":[31,30,30],"fe":[0,0,0],"l101":[61,63,63],"pu":[0,0,0],"be":[61,63,63],"p15":[0,0,0]},"net_added":[null,4,0],"net_removed":[null,2,0],"lfl_index":[100.0,99.74,99.74],"lowest_version_special":[248282,248282,248282],"slider_counts":{"bo":[31,30,30],"fe":[0,0,0],"l101":[61,63,63],"pu":[0,0,0],"be":[61,63,63],"pks":[0,0,0]}},"a5-limousine":{"offers":[355,344,344],"priced":[355,344,344],"special_min":[162545,166101,166101],"special_median":[